{
  "id": "denmark-strait",
  "name": "Denmark Strait",
  "type": "chokepoint",
  "region": "North Atlantic / Arctic",
  "bounds": {
    "north": 68,
    "south": 63,
    "east": -20,
    "west": -40
  },
  "poly": [
    {
      "lat": 68,
      "lon": -20
    },
    {
      "lat": 66.087219,
      "lon": -20
    },
    {
      "lat": 66.161156,
      "lon": -20.091093
    },
    {
      "lat": 66.103727,
      "lon": -20.449948
    },
    {
      "lat": 65.741987,
      "lon": -20.293911
    },
    {
      "lat": 65.621062,
      "lon": -20.39317
    },
    {
      "lat": 65.59604,
      "lon": -20.553923
    },
    {
      "lat": 65.723905,
      "lon": -20.674581
    },
    {
      "lat": 65.628939,
      "lon": -20.929947
    },
    {
      "lat": 65.289687,
      "lon": -21.140417
    },
    {
      "lat": 65.66804,
      "lon": -21.41517
    },
    {
      "lat": 65.847977,
      "lon": -21.249539
    },
    {
      "lat": 66.034214,
      "lon": -21.314351
    },
    {
      "lat": 66.127286,
      "lon": -21.544208
    },
    {
      "lat": 66.100809,
      "lon": -21.696894
    },
    {
      "lat": 66.212002,
      "lon": -21.735298
    },
    {
      "lat": 66.311481,
      "lon": -22.179039
    },
    {
      "lat": 66.493578,
      "lon": -22.422723
    },
    {
      "lat": 66.449465,
      "lon": -22.692766
    },
    {
      "lat": 66.496986,
      "lon": -22.950307
    },
    {
      "lat": 66.458892,
      "lon": -23.150141
    },
    {
      "lat": 66.340548,
      "lon": -23.215813
    },
    {
      "lat": 65.957865,
      "lon": -22.427432
    },
    {
      "lat": 66.085012,
      "lon": -22.675674
    },
    {
      "lat": 66.030002,
      "lon": -22.807242
    },
    {
      "lat": 66.228821,
      "lon": -23.490226
    },
    {
      "lat": 66.075781,
      "lon": -23.831948
    },
    {
      "lat": 65.776322,
      "lon": -23.799036
    },
    {
      "lat": 65.832898,
      "lon": -24.103235
    },
    {
      "lat": 65.617209,
      "lon": -24.092401
    },
    {
      "lat": 65.665241,
      "lon": -24.324807
    },
    {
      "lat": 65.506865,
      "lon": -24.569885
    },
    {
      "lat": 65.374646,
      "lon": -23.899032
    },
    {
      "lat": 65.475552,
      "lon": -23.393422
    },
    {
      "lat": 65.429058,
      "lon": -23.151854
    },
    {
      "lat": 65.527477,
      "lon": -23.153013
    },
    {
      "lat": 65.546238,
      "lon": -22.938887
    },
    {
      "lat": 65.471778,
      "lon": -22.731171
    },
    {
      "lat": 65.5313,
      "lon": -22.534248
    },
    {
      "lat": 65.400874,
      "lon": -22.238835
    },
    {
      "lat": 65.472659,
      "lon": -22.00734
    },
    {
      "lat": 65.033879,
      "lon": -22.903891
    },
    {
      "lat": 65.046499,
      "lon": -23.215161
    },
    {
      "lat": 64.958014,
      "lon": -23.261532
    },
    {
      "lat": 64.960348,
      "lon": -23.853397
    },
    {
      "lat": 64.882979,
      "lon": -24.088939
    },
    {
      "lat": 64.695923,
      "lon": -23.834812
    },
    {
      "lat": 64.802174,
      "lon": -23.300672
    },
    {
      "lat": 64.774187,
      "lon": -22.49369
    },
    {
      "lat": 64.495855,
      "lon": -22.38874
    },
    {
      "lat": 64.533237,
      "lon": -22.277296
    },
    {
      "lat": 64.429662,
      "lon": -22.164874
    },
    {
      "lat": 64.495588,
      "lon": -22.014459
    },
    {
      "lat": 64.303273,
      "lon": -22.127574
    },
    {
      "lat": 64.281273,
      "lon": -21.921354
    },
    {
      "lat": 64.200387,
      "lon": -21.891217
    },
    {
      "lat": 64.007276,
      "lon": -22.422145
    },
    {
      "lat": 64.113651,
      "lon": -22.713591
    },
    {
      "lat": 63.804711,
      "lon": -22.735879
    },
    {
      "lat": 63.861738,
      "lon": -21.2756
    },
    {
      "lat": 63.760248,
      "lon": -20.796832
    },
    {
      "lat": 63.511329,
      "lon": -20
    },
    {
      "lat": 63,
      "lon": -20
    },
    {
      "lat": 63,
      "lon": -40
    },
    {
      "lat": 65.064212,
      "lon": -40
    },
    {
      "lat": 65.287801,
      "lon": -39.743679
    },
    {
      "lat": 65.244992,
      "lon": -39.540833
    },
    {
      "lat": 65.323072,
      "lon": -39.461614
    },
    {
      "lat": 65.525767,
      "lon": -40
    },
    {
      "lat": 65.472236,
      "lon": -39.822563
    },
    {
      "lat": 65.62291,
      "lon": -39.605644
    },
    {
      "lat": 65.515749,
      "lon": -39.319452
    },
    {
      "lat": 65.655318,
      "lon": -39.221618
    },
    {
      "lat": 65.525162,
      "lon": -39.07449
    },
    {
      "lat": 65.618224,
      "lon": -38.210351
    },
    {
      "lat": 65.804806,
      "lon": -38.071597
    },
    {
      "lat": 65.875184,
      "lon": -38.255364
    },
    {
      "lat": 65.912371,
      "lon": -37.984054
    },
    {
      "lat": 66.12472,
      "lon": -37.917231
    },
    {
      "lat": 66.247482,
      "lon": -37.66364
    },
    {
      "lat": 66.363481,
      "lon": -37.840909
    },
    {
      "lat": 66.295343,
      "lon": -37.376559
    },
    {
      "lat": 66.055366,
      "lon": -37.835033
    },
    {
      "lat": 65.704213,
      "lon": -38.017074
    },
    {
      "lat": 65.54872,
      "lon": -37.885464
    },
    {
      "lat": 65.605894,
      "lon": -37.376248
    },
    {
      "lat": 65.836578,
      "lon": -37.065983
    },
    {
      "lat": 65.708732,
      "lon": -36.853945
    },
    {
      "lat": 65.787778,
      "lon": -36.763299
    },
    {
      "lat": 65.770574,
      "lon": -36.611158
    },
    {
      "lat": 66.053998,
      "lon": -36.410639
    },
    {
      "lat": 65.816597,
      "lon": -36.402738
    },
    {
      "lat": 65.829737,
      "lon": -36.211773
    },
    {
      "lat": 66.253706,
      "lon": -35.357521
    },
    {
      "lat": 66.206191,
      "lon": -35.114768
    },
    {
      "lat": 66.345108,
      "lon": -34.639523
    },
    {
      "lat": 66.526773,
      "lon": -34.382166
    },
    {
      "lat": 66.649327,
      "lon": -34.434143
    },
    {
      "lat": 66.549606,
      "lon": -34.257815
    },
    {
      "lat": 66.78178,
      "lon": -33.823812
    },
    {
      "lat": 66.919877,
      "lon": -33.919194
    },
    {
      "lat": 67.153618,
      "lon": -33.353042
    },
    {
      "lat": 67.326417,
      "lon": -33.391112
    },
    {
      "lat": 67.284362,
      "lon": -33.225311
    },
    {
      "lat": 67.512508,
      "lon": -33.256358
    },
    {
      "lat": 67.655797,
      "lon": -33.037929
    },
    {
      "lat": 67.842219,
      "lon": -32.494665
    },
    {
      "lat": 67.822693,
      "lon": -32.130033
    },
    {
      "lat": 68,
      "lon": -32.040821
    }
  ],
  "strategic_value": "medium",
  "carrier_navigable": true,
  "notes": "Passage between Greenland and Iceland connecting the Arctic and North Atlantic.",
  "wiki_url": "https://en.wikipedia.org/wiki/Denmark_Strait"
}
