{
  "id": "bab-el-mandeb",
  "name": "Bab el-Mandeb",
  "type": "chokepoint",
  "region": "Red Sea / Gulf of Aden",
  "bounds": {
    "north": 13.3,
    "south": 11.8,
    "east": 44.5,
    "west": 42.8
  },
  "poly": [
    {
      "lat": 13.3,
      "lon": 43.230401
    },
    {
      "lat": 12.845603,
      "lon": 43.470784
    },
    {
      "lat": 12.681595,
      "lon": 43.46695
    },
    {
      "lat": 12.75364,
      "lon": 43.6008
    },
    {
      "lat": 12.601767,
      "lon": 44.033796
    },
    {
      "lat": 12.667748,
      "lon": 44.416388
    },
    {
      "lat": 12.758525,
      "lon": 44.5
    },
    {
      "lat": 11.8,
      "lon": 44.5
    },
    {
      "lat": 11.8,
      "lon": 43.053028
    },
    {
      "lat": 12.027846,
      "lon": 43.400691
    },
    {
      "lat": 12.225358,
      "lon": 43.41683
    },
    {
      "lat": 12.489961,
      "lon": 43.331604
    },
    {
      "lat": 12.86746,
      "lon": 43.044915
    },
    {
      "lat": 12.902479,
      "lon": 42.99967
    },
    {
      "lat": 12.792318,
      "lon": 42.92773
    },
    {
      "lat": 12.852411,
      "lon": 42.8
    },
    {
      "lat": 13.3,
      "lon": 42.8
    }
  ],
  "strategic_value": "critical",
  "carrier_navigable": true,
  "notes": "Southern Red Sea chokepoint linking the Red Sea and Gulf of Aden.",
  "wiki_url": "https://en.wikipedia.org/wiki/Bab-el-Mandeb"
}
