{
  "id": "resund",
  "name": "Øresund",
  "type": "chokepoint",
  "region": "Denmark / Sweden",
  "bounds": {
    "north": 56.2,
    "south": 55.4,
    "east": 13.2,
    "west": 12.3
  },
  "poly": [
    {
      "lat": 56.2,
      "lon": 12.3
    },
    {
      "lat": 56.2,
      "lon": 13.2
    },
    {
      "lat": 55.4,
      "lon": 13.2
    },
    {
      "lat": 55.4,
      "lon": 12.3
    }
  ],
  "strategic_value": "medium",
  "carrier_navigable": false,
  "notes": "Danish strait between Zealand and Sweden; shallow depth limits large carrier transit.",
  "wiki_url": "https://en.wikipedia.org/wiki/%C3%98resund"
}
