{
  "id": "luzon-strait",
  "name": "Luzon Strait",
  "type": "chokepoint",
  "region": "Western Pacific",
  "bounds": {
    "north": 22.2,
    "south": 18,
    "east": 123.5,
    "west": 120
  },
  "poly": [
    {
      "lat": 22.2,
      "lon": 120.654012
    },
    {
      "lat": 21.944855,
      "lon": 120.695183
    },
    {
      "lat": 21.898313,
      "lon": 120.840572
    },
    {
      "lat": 22.2,
      "lon": 120.882963
    },
    {
      "lat": 22.2,
      "lon": 123.5
    },
    {
      "lat": 18,
      "lon": 123.5
    },
    {
      "lat": 18,
      "lon": 122.188885
    },
    {
      "lat": 18.110406,
      "lon": 122.179928
    },
    {
      "lat": 18.337181,
      "lon": 122.331236
    },
    {
      "lat": 18.587024,
      "lon": 122.147558
    },
    {
      "lat": 18.398523,
      "lon": 122.108032
    },
    {
      "lat": 18.285485,
      "lon": 121.896241
    },
    {
      "lat": 18.346009,
      "lon": 121.628494
    },
    {
      "lat": 18.63135,
      "lon": 121.172938
    },
    {
      "lat": 18.573394,
      "lon": 120.911404
    },
    {
      "lat": 18.652239,
      "lon": 120.83441
    },
    {
      "lat": 18.490094,
      "lon": 120.555455
    },
    {
      "lat": 18,
      "lon": 120.468897
    },
    {
      "lat": 18,
      "lon": 120
    },
    {
      "lat": 22.2,
      "lon": 120
    }
  ],
  "strategic_value": "high",
  "carrier_navigable": true,
  "notes": "Deep passage between Taiwan and Luzon connecting the South China Sea and Philippine Sea.",
  "wiki_url": "https://en.wikipedia.org/wiki/Luzon_Strait"
}
