{
  "id": "great-belt",
  "name": "Great Belt",
  "type": "chokepoint",
  "region": "Denmark",
  "bounds": {
    "north": 56.2,
    "south": 54.8,
    "east": 11.6,
    "west": 10.5
  },
  "poly": [
    {
      "lat": 56.2,
      "lon": 10.684511
    },
    {
      "lat": 56.2,
      "lon": 10.753463
    },
    {
      "lat": 56.2,
      "lon": 11.6
    },
    {
      "lat": 55.944205,
      "lon": 11.6
    },
    {
      "lat": 55.997541,
      "lon": 11.270773
    },
    {
      "lat": 55.907519,
      "lon": 11.508289
    },
    {
      "lat": 55.757692,
      "lon": 11.351226
    },
    {
      "lat": 55.702502,
      "lon": 11.192484
    },
    {
      "lat": 55.742743,
      "lon": 10.873399
    },
    {
      "lat": 55.662496,
      "lon": 11.082443
    },
    {
      "lat": 55.667629,
      "lon": 10.927842
    },
    {
      "lat": 55.575313,
      "lon": 11.143677
    },
    {
      "lat": 55.512387,
      "lon": 11.078923
    },
    {
      "lat": 55.404466,
      "lon": 11.212036
    },
    {
      "lat": 55.357959,
      "lon": 11.085722
    },
    {
      "lat": 55.198893,
      "lon": 11.259757
    },
    {
      "lat": 55.188976,
      "lon": 11.6
    },
    {
      "lat": 54.814756,
      "lon": 11.590325
    },
    {
      "lat": 54.963349,
      "lon": 11.231654
    },
    {
      "lat": 54.920753,
      "lon": 11.030927
    },
    {
      "lat": 54.812671,
      "lon": 11.088707
    },
    {
      "lat": 54.8,
      "lon": 10.76833
    },
    {
      "lat": 55.161753,
      "lon": 10.934205
    },
    {
      "lat": 54.839589,
      "lon": 10.599408
    },
    {
      "lat": 54.8,
      "lon": 10.5
    },
    {
      "lat": 55.034488,
      "lon": 10.5
    },
    {
      "lat": 55.070156,
      "lon": 10.734902
    },
    {
      "lat": 55.289995,
      "lon": 10.836403
    },
    {
      "lat": 55.460311,
      "lon": 10.606325
    },
    {
      "lat": 55.495219,
      "lon": 10.74655
    },
    {
      "lat": 55.615467,
      "lon": 10.628563
    },
    {
      "lat": 55.466066,
      "lon": 10.5
    },
    {
      "lat": 56.2,
      "lon": 10.58507
    }
  ],
  "strategic_value": "medium",
  "carrier_navigable": true,
  "notes": "Primary deep-water Danish strait between the Kattegat and Baltic Sea.",
  "wiki_url": "https://en.wikipedia.org/wiki/Great_Belt"
}
