{
  "id": "bass-strait",
  "name": "Bass Strait",
  "type": "chokepoint",
  "region": "Australia",
  "bounds": {
    "north": -38,
    "south": -41.5,
    "east": 149,
    "west": 144
  },
  "poly": [
    {
      "lat": -38,
      "lon": 145.020576
    },
    {
      "lat": -38.12542,
      "lon": 145.121556
    },
    {
      "lat": -38.328815,
      "lon": 144.987252
    },
    {
      "lat": -38.338314,
      "lon": 144.671297
    },
    {
      "lat": -38.517807,
      "lon": 144.94539
    },
    {
      "lat": -38.419172,
      "lon": 145.233633
    },
    {
      "lat": -38.24441,
      "lon": 145.266428
    },
    {
      "lat": -38.241095,
      "lon": 145.460488
    },
    {
      "lat": -38.380789,
      "lon": 145.548641
    },
    {
      "lat": -38.421217,
      "lon": 145.415892
    },
    {
      "lat": -38.542051,
      "lon": 145.367704
    },
    {
      "lat": -38.687374,
      "lon": 145.597761
    },
    {
      "lat": -38.656948,
      "lon": 145.805814
    },
    {
      "lat": -38.913529,
      "lon": 145.918118
    },
    {
      "lat": -38.827564,
      "lon": 146.090477
    },
    {
      "lat": -38.874392,
      "lon": 146.177075
    },
    {
      "lat": -39.152451,
      "lon": 146.394358
    },
    {
      "lat": -39.066574,
      "lon": 146.490653
    },
    {
      "lat": -38.807473,
      "lon": 146.483607
    },
    {
      "lat": -38.902765,
      "lon": 146.290259
    },
    {
      "lat": -38.720395,
      "lon": 146.228791
    },
    {
      "lat": -38.69177,
      "lon": 146.850877
    },
    {
      "lat": -38,
      "lon": 147.746569
    },
    {
      "lat": -38,
      "lon": 149
    },
    {
      "lat": -41.5,
      "lon": 149
    },
    {
      "lat": -41.5,
      "lon": 148.29283
    },
    {
      "lat": -40.979873,
      "lon": 148.332649
    },
    {
      "lat": -40.736446,
      "lon": 148.02199
    },
    {
      "lat": -40.881499,
      "lon": 147.847409
    },
    {
      "lat": -40.821258,
      "lon": 147.648793
    },
    {
      "lat": -41.000621,
      "lon": 147.443361
    },
    {
      "lat": -40.934674,
      "lon": 147.343351
    },
    {
      "lat": -40.998831,
      "lon": 147.170003
    },
    {
      "lat": -40.969317,
      "lon": 147.016052
    },
    {
      "lat": -41.071933,
      "lon": 146.812681
    },
    {
      "lat": -41.154116,
      "lon": 146.926022
    },
    {
      "lat": -41.150177,
      "lon": 146.813004
    },
    {
      "lat": -41.058026,
      "lon": 146.744029
    },
    {
      "lat": -41.171972,
      "lon": 146.584043
    },
    {
      "lat": -41.147987,
      "lon": 146.216019
    },
    {
      "lat": -41.019999,
      "lon": 145.81273
    },
    {
      "lat": -40.838733,
      "lon": 145.526454
    },
    {
      "lat": -40.8319,
      "lon": 145.336707
    },
    {
      "lat": -40.712645,
      "lon": 145.27076
    },
    {
      "lat": -40.78512,
      "lon": 145.245677
    },
    {
      "lat": -40.800638,
      "lon": 145.079933
    },
    {
      "lat": -40.735568,
      "lon": 144.891154
    },
    {
      "lat": -40.711259,
      "lon": 145.072397
    },
    {
      "lat": -40.607836,
      "lon": 144.930215
    },
    {
      "lat": -40.731349,
      "lon": 144.879215
    },
    {
      "lat": -40.655177,
      "lon": 144.693055
    },
    {
      "lat": -40.86929,
      "lon": 144.6965
    },
    {
      "lat": -40.995785,
      "lon": 144.59834
    },
    {
      "lat": -41.5,
      "lon": 144.82042
    },
    {
      "lat": -41.5,
      "lon": 144
    },
    {
      "lat": -40.098966,
      "lon": 144
    },
    {
      "lat": -39.926821,
      "lon": 144.152277
    },
    {
      "lat": -39.66255,
      "lon": 144.115989
    },
    {
      "lat": -39.570972,
      "lon": 144
    },
    {
      "lat": -38.540238,
      "lon": 144.004777
    },
    {
      "lat": -38.307972,
      "lon": 144.405162
    },
    {
      "lat": -38.293068,
      "lon": 144.654776
    },
    {
      "lat": -38.139449,
      "lon": 144.708246
    },
    {
      "lat": -38.143278,
      "lon": 144.371795
    },
    {
      "lat": -38,
      "lon": 144.704786
    }
  ],
  "strategic_value": "medium",
  "carrier_navigable": true,
  "notes": "Passage between mainland Australia and Tasmania.",
  "wiki_url": "https://en.wikipedia.org/wiki/Bass_Strait"
}
