{
  "id": "la-perouse-strait",
  "name": "La Pérouse Strait",
  "type": "chokepoint",
  "region": "Russia / Japan",
  "bounds": {
    "north": 46.5,
    "south": 45.5,
    "east": 143.5,
    "west": 141
  },
  "poly": [
    {
      "lat": 46.5,
      "lon": 141.816177
    },
    {
      "lat": 46.034294,
      "lon": 141.929191
    },
    {
      "lat": 45.897075,
      "lon": 142.085387
    },
    {
      "lat": 46.5,
      "lon": 142.383888
    },
    {
      "lat": 46.5,
      "lon": 143.332947
    },
    {
      "lat": 46.021667,
      "lon": 143.429295
    },
    {
      "lat": 46.207597,
      "lon": 143.5
    },
    {
      "lat": 45.5,
      "lon": 143.5
    },
    {
      "lat": 45.5,
      "lon": 141
    },
    {
      "lat": 46.5,
      "lon": 141
    }
  ],
  "strategic_value": "medium",
  "carrier_navigable": true,
  "notes": "Passage between Hokkaido and Sakhalin.",
  "wiki_url": "https://en.wikipedia.org/wiki/La_P%C3%A9rouse_Strait"
}
