{
  "id": "tsushima-strait",
  "name": "Tsushima Strait",
  "type": "chokepoint",
  "region": "Korea / Japan",
  "bounds": {
    "north": 35.2,
    "south": 33.5,
    "east": 131.5,
    "west": 128
  },
  "poly": [
    {
      "lat": 35.2,
      "lon": 128.606556
    },
    {
      "lat": 35.074305,
      "lon": 128.760673
    },
    {
      "lat": 35.127339,
      "lon": 128.9569
    },
    {
      "lat": 35.038399,
      "lon": 128.965063
    },
    {
      "lat": 35.2,
      "lon": 129.234229
    },
    {
      "lat": 35.2,
      "lon": 131.5
    },
    {
      "lat": 34.544872,
      "lon": 131.5
    },
    {
      "lat": 34.389438,
      "lon": 131.28379
    },
    {
      "lat": 34.378496,
      "lon": 131.216096
    },
    {
      "lat": 34.442557,
      "lon": 131.253546
    },
    {
      "lat": 34.373254,
      "lon": 131.169789
    },
    {
      "lat": 34.43183,
      "lon": 130.955879
    },
    {
      "lat": 34.384037,
      "lon": 131.021646
    },
    {
      "lat": 34.357721,
      "lon": 130.895394
    },
    {
      "lat": 34.112702,
      "lon": 130.856333
    },
    {
      "lat": 33.908817,
      "lon": 130.914856
    },
    {
      "lat": 34.041824,
      "lon": 131.037854
    },
    {
      "lat": 33.919548,
      "lon": 131.257717
    },
    {
      "lat": 34.033065,
      "lon": 131.390635
    },
    {
      "lat": 33.97615,
      "lon": 131.402209
    },
    {
      "lat": 34.023596,
      "lon": 131.490217
    },
    {
      "lat": 33.634574,
      "lon": 131.471176
    },
    {
      "lat": 33.580104,
      "lon": 131.367638
    },
    {
      "lat": 33.639229,
      "lon": 131.084511
    },
    {
      "lat": 33.818758,
      "lon": 130.967103
    },
    {
      "lat": 33.971288,
      "lon": 131.006724
    },
    {
      "lat": 33.896262,
      "lon": 130.911795
    },
    {
      "lat": 33.948888,
      "lon": 130.755378
    },
    {
      "lat": 33.860124,
      "lon": 130.486709
    },
    {
      "lat": 33.722783,
      "lon": 130.441488
    },
    {
      "lat": 33.683487,
      "lon": 130.284385
    },
    {
      "lat": 33.609879,
      "lon": 130.388087
    },
    {
      "lat": 33.580708,
      "lon": 130.289467
    },
    {
      "lat": 33.670126,
      "lon": 130.206573
    },
    {
      "lat": 33.575068,
      "lon": 130.08804
    },
    {
      "lat": 33.537514,
      "lon": 130.163807
    },
    {
      "lat": 33.5,
      "lon": 130.05312
    },
    {
      "lat": 33.571107,
      "lon": 129.883725
    },
    {
      "lat": 33.5,
      "lon": 129.834401
    },
    {
      "lat": 33.5,
      "lon": 128
    },
    {
      "lat": 34.699334,
      "lon": 128
    },
    {
      "lat": 34.803757,
      "lon": 128.079967
    },
    {
      "lat": 34.831558,
      "lon": 128
    },
    {
      "lat": 34.835579,
      "lon": 128.087617
    },
    {
      "lat": 35.029414,
      "lon": 128.009314
    },
    {
      "lat": 35.066628,
      "lon": 128.06071
    },
    {
      "lat": 34.937469,
      "lon": 128.046257
    },
    {
      "lat": 34.88714,
      "lon": 128.13723
    },
    {
      "lat": 34.939465,
      "lon": 128.333685
    },
    {
      "lat": 34.83807,
      "lon": 128.436573
    },
    {
      "lat": 34.983317,
      "lon": 128.426801
    },
    {
      "lat": 35.021614,
      "lon": 128.502739
    },
    {
      "lat": 35.044495,
      "lon": 128.393003
    },
    {
      "lat": 35.098963,
      "lon": 128.511515
    },
    {
      "lat": 35.057005,
      "lon": 128.655062
    }
  ],
  "strategic_value": "high",
  "carrier_navigable": true,
  "notes": "Main passage between the East China Sea and Sea of Japan.",
  "wiki_url": "https://en.wikipedia.org/wiki/Tsushima_Strait"
}
