{
  "id": "dardanelles",
  "name": "Dardanelles",
  "type": "chokepoint",
  "region": "Turkey",
  "bounds": {
    "north": 40.5,
    "south": 39.9,
    "east": 26.8,
    "west": 26
  },
  "poly": [
    {
      "lat": 40.5,
      "lon": 26.561019
    },
    {
      "lat": 40.323309,
      "lon": 26.208527
    },
    {
      "lat": 40.230564,
      "lon": 26.269922
    },
    {
      "lat": 40.04792,
      "lon": 26.166567
    },
    {
      "lat": 40.49421,
      "lon": 26.759999
    },
    {
      "lat": 40.405993,
      "lon": 26.8
    },
    {
      "lat": 40.195226,
      "lon": 26.406712
    },
    {
      "lat": 39.9,
      "lon": 26.154614
    },
    {
      "lat": 39.9,
      "lon": 26
    },
    {
      "lat": 40.5,
      "lon": 26
    }
  ],
  "strategic_value": "high",
  "carrier_navigable": false,
  "notes": "Strait connecting the Aegean Sea and Sea of Marmara.",
  "wiki_url": "https://en.wikipedia.org/wiki/Dardanelles"
}
