{
  "id": "balabac-strait",
  "name": "Balabac Strait",
  "type": "chokepoint",
  "region": "Philippines / Malaysia",
  "bounds": {
    "north": 8.5,
    "south": 7.1,
    "east": 117.8,
    "west": 116.4
  },
  "poly": [
    {
      "lat": 8.5,
      "lon": 116.4
    },
    {
      "lat": 8.5,
      "lon": 117.8
    },
    {
      "lat": 7.1,
      "lon": 117.8
    },
    {
      "lat": 7.1,
      "lon": 116.4
    }
  ],
  "strategic_value": "medium",
  "carrier_navigable": true,
  "notes": "Passage between Palawan and Borneo linking the Sulu Sea and South China Sea.",
  "wiki_url": "https://en.wikipedia.org/wiki/Balabac_Strait"
}
