{
  "id": "strait-of-hormuz",
  "name": "Strait of Hormuz",
  "type": "chokepoint",
  "region": "Persian Gulf / Gulf of Oman",
  "bounds": {
    "north": 26.9,
    "south": 25.2,
    "east": 57.3,
    "west": 55
  },
  "poly": [
    {
      "lat": 26.9,
      "lon": 55.772485
    },
    {
      "lat": 26.789125,
      "lon": 55.75247
    },
    {
      "lat": 26.662938,
      "lon": 55.282549
    },
    {
      "lat": 26.546483,
      "lon": 55.287731
    },
    {
      "lat": 26.738938,
      "lon": 55.876274
    },
    {
      "lat": 26.69308,
      "lon": 55.948332
    },
    {
      "lat": 26.9,
      "lon": 56.171816
    },
    {
      "lat": 26.866435,
      "lon": 57.008769
    },
    {
      "lat": 26.414296,
      "lon": 57.077048
    },
    {
      "lat": 26.166427,
      "lon": 57.209071
    },
    {
      "lat": 26.082052,
      "lon": 57.16344
    },
    {
      "lat": 25.84773,
      "lon": 57.295316
    },
    {
      "lat": 25.2,
      "lon": 57.3
    },
    {
      "lat": 25.2,
      "lon": 56.369184
    },
    {
      "lat": 25.526454,
      "lon": 56.373332
    },
    {
      "lat": 25.672626,
      "lon": 56.270134
    },
    {
      "lat": 25.946017,
      "lon": 56.45655
    },
    {
      "lat": 26.03711,
      "lon": 56.383916
    },
    {
      "lat": 26.098662,
      "lon": 56.476442
    },
    {
      "lat": 26.172502,
      "lon": 56.332933
    },
    {
      "lat": 26.143331,
      "lon": 56.482218
    },
    {
      "lat": 26.217537,
      "lon": 56.43721
    },
    {
      "lat": 26.268991,
      "lon": 56.403329
    },
    {
      "lat": 26.333429,
      "lon": 56.514528
    },
    {
      "lat": 26.389422,
      "lon": 56.369965
    },
    {
      "lat": 26.220796,
      "lon": 56.305065
    },
    {
      "lat": 26.217881,
      "lon": 56.401546
    },
    {
      "lat": 26.248564,
      "lon": 56.179507
    },
    {
      "lat": 25.891291,
      "lon": 56.020431
    },
    {
      "lat": 25.539519,
      "lon": 55.624449
    },
    {
      "lat": 25.580975,
      "lon": 55.548534
    },
    {
      "lat": 25.284877,
      "lon": 55.30081
    },
    {
      "lat": 25.204292,
      "lon": 55.326114
    },
    {
      "lat": 25.264136,
      "lon": 55.282515
    },
    {
      "lat": 25.2,
      "lon": 55.241326
    },
    {
      "lat": 25.261411,
      "lon": 55.17667
    },
    {
      "lat": 25.2,
      "lon": 55
    },
    {
      "lat": 26.618832,
      "lon": 55
    },
    {
      "lat": 26.789014,
      "lon": 55.271348
    },
    {
      "lat": 26.781704,
      "lon": 55.523655
    },
    {
      "lat": 26.9,
      "lon": 55.588117
    }
  ],
  "strategic_value": "critical",
  "carrier_navigable": true,
  "notes": "Primary maritime chokepoint between the Persian Gulf and Gulf of Oman. Deep-water traffic separation schemes support very large commercial traffic and naval vessels.",
  "wiki_url": "https://en.wikipedia.org/wiki/Strait_of_Hormuz"
}
