{
  "id": "ombai-strait",
  "name": "Ombai Strait",
  "type": "chokepoint",
  "region": "Indonesia / Timor-Leste",
  "bounds": {
    "north": -8,
    "south": -9.342335,
    "east": 126.5,
    "west": 124
  },
  "poly": [
    {
      "lat": -8,
      "lon": 125.718441
    },
    {
      "lat": -8.059344,
      "lon": 125.737931
    },
    {
      "lat": -8,
      "lon": 125.760259
    },
    {
      "lat": -8,
      "lon": 126.5
    },
    {
      "lat": -8.443991,
      "lon": 126.5
    },
    {
      "lat": -8.517791,
      "lon": 126.068923
    },
    {
      "lat": -8.480107,
      "lon": 125.850067
    },
    {
      "lat": -8.627885,
      "lon": 125.143112
    },
    {
      "lat": -8.939617,
      "lon": 124.951516
    },
    {
      "lat": -9.152971,
      "lon": 124.602634
    },
    {
      "lat": -9.342335,
      "lon": 124
    },
    {
      "lat": -8.434068,
      "lon": 124
    },
    {
      "lat": -8.554645,
      "lon": 124.057253
    },
    {
      "lat": -8.542353,
      "lon": 124.151793
    },
    {
      "lat": -8.220292,
      "lon": 124.311862
    },
    {
      "lat": -8.179002,
      "lon": 124.25598
    },
    {
      "lat": -8.379121,
      "lon": 124.105899
    },
    {
      "lat": -8.30271,
      "lon": 124.059996
    },
    {
      "lat": -8.324124,
      "lon": 124
    },
    {
      "lat": -8,
      "lon": 124
    }
  ],
  "strategic_value": "medium",
  "carrier_navigable": true,
  "notes": "Deep passage north of Timor used as an alternative route between the Pacific and Indian Ocean.",
  "wiki_url": "https://en.wikipedia.org/wiki/Ombai_Strait"
}
