{
  "id": "kerch-strait",
  "name": "Kerch Strait",
  "type": "chokepoint",
  "region": "Black Sea / Sea of Azov",
  "bounds": {
    "north": 45.6,
    "south": 44.9,
    "east": 36.8,
    "west": 35.9
  },
  "poly": [
    {
      "lat": 45.6,
      "lon": 36.8
    },
    {
      "lat": 45.431683,
      "lon": 36.8
    },
    {
      "lat": 45.340355,
      "lon": 36.664515
    },
    {
      "lat": 45.372427,
      "lon": 36.8
    },
    {
      "lat": 45.233745,
      "lon": 36.8
    },
    {
      "lat": 45.194133,
      "lon": 36.575322
    },
    {
      "lat": 45.112555,
      "lon": 36.8
    },
    {
      "lat": 44.9,
      "lon": 36.8
    },
    {
      "lat": 44.9,
      "lon": 35.9
    },
    {
      "lat": 44.997194,
      "lon": 35.9
    },
    {
      "lat": 45.046569,
      "lon": 36.048208
    },
    {
      "lat": 45.005518,
      "lon": 36.224748
    },
    {
      "lat": 45.065706,
      "lon": 36.441094
    },
    {
      "lat": 45.270835,
      "lon": 36.438887
    },
    {
      "lat": 45.351256,
      "lon": 36.640357
    },
    {
      "lat": 45.429253,
      "lon": 36.584002
    },
    {
      "lat": 45.47863,
      "lon": 36.284018
    },
    {
      "lat": 45.374044,
      "lon": 35.947252
    },
    {
      "lat": 45.6,
      "lon": 35.9
    }
  ],
  "strategic_value": "medium",
  "carrier_navigable": false,
  "notes": "Shallow passage between the Black Sea and Sea of Azov; unsuitable for aircraft carriers.",
  "wiki_url": "https://en.wikipedia.org/wiki/Kerch_Strait"
}
