{
  "id": "korea-strait",
  "name": "Korea Strait",
  "type": "chokepoint",
  "region": "Korea / Japan",
  "bounds": {
    "north": 35.5,
    "south": 33,
    "east": 131.5,
    "west": 128
  },
  "poly": [
    {
      "lat": 35.5,
      "lon": 128
    },
    {
      "lat": 35.5,
      "lon": 131.5
    },
    {
      "lat": 33,
      "lon": 131.5
    },
    {
      "lat": 33,
      "lon": 128
    }
  ],
  "strategic_value": "high",
  "carrier_navigable": true,
  "notes": "Broad strategic strait connecting the East China Sea and Sea of Japan.",
  "wiki_url": "https://en.wikipedia.org/wiki/Korea_Strait"
}
