{
  "id": "bering-strait",
  "name": "Bering Strait",
  "type": "chokepoint",
  "region": "Arctic / North Pacific",
  "bounds": {
    "north": 66.5,
    "south": 65.3,
    "east": -168,
    "west": -170.5
  },
  "poly": [
    {
      "lat": 66.5,
      "lon": -170.5
    },
    {
      "lat": 66.5,
      "lon": -168
    },
    {
      "lat": 65.3,
      "lon": -168
    },
    {
      "lat": 65.3,
      "lon": -170.5
    }
  ],
  "strategic_value": "high",
  "carrier_navigable": true,
  "notes": "Only marine passage between the Pacific and Arctic oceans; seasonal ice and shallow depths constrain operations.",
  "wiki_url": "https://en.wikipedia.org/wiki/Bering_Strait"
}
