{
  "id": "kattegat",
  "name": "Kattegat",
  "type": "sea_lane",
  "region": "Denmark / Sweden",
  "bounds": {
    "north": 58.2,
    "south": 55.5,
    "east": 13,
    "west": 9.5
  },
  "poly": [
    {
      "lat": 58.2,
      "lon": 9.5
    },
    {
      "lat": 58.2,
      "lon": 13
    },
    {
      "lat": 55.5,
      "lon": 13
    },
    {
      "lat": 55.5,
      "lon": 9.5
    }
  ],
  "strategic_value": "medium",
  "carrier_navigable": true,
  "notes": "Sea area connecting the Skagerrak and Danish straits.",
  "wiki_url": "https://en.wikipedia.org/wiki/Kattegat"
}
