{
  "id": "strait-of-otranto",
  "name": "Strait of Otranto",
  "type": "chokepoint",
  "region": "Adriatic / Ionian Sea",
  "bounds": {
    "north": 41,
    "south": 39.3,
    "east": 20,
    "west": 18
  },
  "poly": [
    {
      "lat": 41,
      "lon": 18
    },
    {
      "lat": 41,
      "lon": 20
    },
    {
      "lat": 39.3,
      "lon": 20
    },
    {
      "lat": 39.3,
      "lon": 18
    }
  ],
  "strategic_value": "medium",
  "carrier_navigable": true,
  "notes": "Entrance to the Adriatic Sea between Italy and Albania.",
  "wiki_url": "https://en.wikipedia.org/wiki/Strait_of_Otranto"
}
